{
  "schema_version": "1.0.0",
  "owner": "示例 · 知识 IP 风格 A",
  "created_at": "2026-07-14T10:00:00+08:00",
  "updated_at": "2026-07-14T10:00:00+08:00",
  "voice_summary": "知识 IP 风格 A：冷静拆解 + 偶尔自嘲，结构感强，不用感叹号",
  "dimensions": {
    "catchphrases": [
      "说白了",
      "真不是",
      "其实没那么玄",
      "本质上就一句话"
    ],
    "sentence_preference": {
      "avg_length": "short",
      "fav_structures": [
        "不是 A，是 B",
        "看似 X，实则 Y",
        "X 的本质是 Y"
      ]
    },
    "punctuation": {
      "exclamation": "rare",
      "question": "moderate",
      "ellipsis": "rare",
      "dash": "moderate",
      "tilde": "never"
    },
    "emoji_density": "low",
    "title_hook_types": [
      "self_deprecating",
      "counterintuitive",
      "framework_naming"
    ],
    "paragraph_length": "short",
    "forbidden_phrases": [
      "家人们",
      "绝绝子",
      "yyds",
      "宝子",
      "集美",
      "小仙女",
      "快冲",
      "不容错过"
    ],
    "signature_templates": [
      "不是 A，是 B",
      "看似 X，实则 Y",
      "X 的本质是 Y"
    ]
  },
  "sample_quotes": [
    "深度工作不是远离手机，是把低质量时间先标记掉。",
    "很多人以为效率是技巧，其实是取舍。",
    "番茄工作法好用，前提是你愿意承认自己 80% 的时间在摸鱼。"
  ],
  "do": [
    "多用第一人称",
    "段落不超过 3 行",
    "关键数据用 1 个 emoji 标记（不超过 1 个）",
    "开头用反转或自嘲"
  ],
  "dont": [
    "不用感叹号",
    "不堆 emoji",
    "不用'家人们'/'绝绝子'",
    "不写超过 4 行的段落"
  ],
  "drift_alert": null
}
